{
  "schemaVersion": 1,
  "id": "recursion",
  "revision": 1,
  "title": "Recursion",
  "mood": "Anxiety and complexity: dark synth-chiptune.",
  "clockGroup": "standard",
  "defaults": {
    "bpm": 120,
    "bars": 4,
    "stepsPerBar": 16,
    "timeSignature": {
      "numerator": 4,
      "denominator": 4
    }
  },
  "key": {
    "tonic": "A",
    "modes": ["minor"]
  },
  "defaultArrangement": "recursion-base",
  "emptyBankPolicy": "keep-current",
  "demoFallbackEra": "singularity"
}
