{
  "schemaVersion": 1,
  "id": "self-improvement",
  "revision": 1,
  "title": "Self-Improvement",
  "mood": "Ominous, unstable: industrial cyberpunk.",
  "clockGroup": "standard",
  "defaults": {
    "bpm": 120,
    "bars": 4,
    "stepsPerBar": 16,
    "timeSignature": {
      "numerator": 4,
      "denominator": 4
    }
  },
  "key": {
    "tonic": "E",
    "modes": ["minor", "phrygian"]
  },
  "defaultArrangement": "self-improvement-base",
  "emptyBankPolicy": "keep-current",
  "demoFallbackEra": "singularity"
}
