{
  "schemaVersion": 1,
  "id": "acceleration",
  "revision": 1,
  "title": "Acceleration",
  "mood": "Excitement and optimism: energetic chiptune.",
  "clockGroup": "standard",
  "defaults": {
    "bpm": 120,
    "bars": 4,
    "stepsPerBar": 16,
    "timeSignature": {
      "numerator": 4,
      "denominator": 4
    }
  },
  "key": {
    "tonic": "G",
    "modes": ["major", "mixolydian"]
  },
  "defaultArrangement": "acceleration-base",
  "emptyBankPolicy": "keep-current",
  "demoFallbackEra": "discovery"
}
